reviewId,content,score,thumbsUpCount,at,replyContent,repliedAt,appName
e33b6151-b57e-4253-9eb2-2fef95c5e93b,"I have used online shopping for years. There are a couple of things I would like to change back is the ability to put in my own price range for items I am looking up. also, it is probably a glitch when you search for an item and there are items in that look up that don't belong. if I am looking up adult clothing I don't want to see children clothing, for example.",4,5,1625769755000,,,Walmart
a9b70549-940c-4831-86f2-605ac0409b24,"Currently 03/03/2022, the app will not allow EBT card to be added to wallet. This is a new issue. I keep getting the ""Sorry, technical issue, try again later"" message. This has been the status since Monday, Feb 28. Tried everything to fix this, uninstall, sign out and in, etc. I need to order groceries! Please look into this. Now I can't open or use my cart, or set up a delivery time. Customer service said it may take 48 hours for tech to look into it. Thanks.",1,12,1646537043000,,,Walmart
0558a0df-2418-4ef8-9917-2a26a67a1de4,"The app is great. Very easy for a person with advanced rheumatoid arthritis to use. Most retailers, I have to fire up my computer and use their website. This app is well-done for people like me. Also, I also really like being able to scroll back a year or more to look up big-ticket items and items I bought at the store as well as through the app. I live in a remote area with limited retail and services, and having this app be user-friendly is a huge relief.",5,27,1669931592000,,,Walmart
4c982237-819e-44ab-a8b8-1f45d8f30f99,"This app is literally THE WORST now. It was so user friendly before all of these dumb updates. It's confusing because it tries to add items to your cart to be shipped, which makes no sense for grocery pickup. Also, the item list is weird now and won't just let you add anything from it to your cart. I'm not sure why these changes were made..it makes no sense. Change it back, it's horrible!!!!!!!!!! It makes me not even want to use it anymore.",1,326,1628763745000,,,Walmart
ae151e23-a002-48d9-8007-3e686d397942,"Terrible App. The previous one was much better. Nothing but a headache! Lumps food delivery and online shopping, other ordering together, creating a lot of confusion! Has a lot of issues with even opening up. I shop at Walmart all the time and this faulty new app is keeping me from a lot of needed shopping. And I pay the monthly subsciption fee for home delivery. Have not been able to open it in over a day. Walmart, please go back to separating online retail shopping from home grocery delivery!",1,10,1633609629000,Thanks for sharing your experience with us. We’re sorry you’ve had issues while using the Walmart app. We’ve shared your experience with our App Development Team. They release new app features each week based on customer feedback like yours. Make sure you check for app updates regularly.,1634232704000,Walmart
1c3b6783-03b8-421d-8baf-14ed35f2bc8e,"Massive improvement from the last time I tried this. I intstalled the app, tapped ""Use precise location"" (instead of ""Enter Zip Code""). Then entered the product I was looking for. A lot of the app helps you set up for a delivery or pickup (so obviously you wouldn't need the aisle number). But I was able to find that. (Really, that should be the first thing at the top of the results page.) I also saw an option for time frame - Today, Next Three Days, This Week. I choose Today. Great app! 👍",5,37,1654312207000,Thanks for using the Walmart app! We appreciate you taking the time to rate us!,1674699683000,Walmart
6f394a7f-7ab7-4166-8c9d-0386b06d3934,"Used to eork great. But lately, there is LOTS of problems. Clicking on several options (like editing substitutions) just gets an ""Oops! Something went wrong. Try again later."" Or ""Our system is exoeriencing difficulties"" These issues have made the app pretty much useless. I have been having to use my PC to get any business done with Walmart online.",2,25,1616110600000,,,Walmart
0b84d4db-9b59-41e9-8f0c-5ba28e0b78bf,"I used to really like the Walmart app. It WAS easy to use. The new update is horrible. You can't search other stores to find if an item is in stock. Pharmacy isn't in the app anymore and harder to find. It's harder to find locations of items in store because nothing shows in stock. I could keep going, but I think you get the idea. I would rate less than one star if I could.",1,9,1635199485000,We are sorry to hear you are having issues using the Pharmacy feature within our app. We are in the process of rolling out a better experience and in the interim you will be directed to the webpage to complete your Pharmacy order. Please contact us at walmart.com/help for any additional questions.,1645568934000,Walmart
64fae61a-a5f4-42c3-8f8e-811243c76660,"The new app is rubbish. Trying to navigate and see what is available by location seems impossible. I can no longer sort the search results in a way that is helpful. Sadly on my phone it if I use the website it redirects me to the app no matter what. I don't see myself placing orders anymore, it should be easy to find what I want and it's not.",1,14,1627247349000,,,Walmart
cd71f962-0b23-40a4-96e2-e11571527d50,"The new beta app is terrible, the areas I use all the time are gone. Prescription refill scanner is gone. Price check scanner is gone or moved. To refill scripts it sends you elsewhere, makes me think I have been sent to a bogus site trying to steal my account information. You really out did yourselves in trying to screw up a decent app. There is no navigation or help screen. This beta version should be trashed, it is junk!",1,0,1631944315000,,,Walmart
a81aab6d-3a40-4548-974c-a79570f24956,"Update made it unusable, my most ordered items switched to ""not available for curbside,"" it lags, and the favorites tabs have disappeared. It now has this ""next"" system and its total BS + unusable. Several ""favorited"" items have disappeared, when I look for them again it adds it a wishlist which isn't what I wanted. It was originally nice seeing all the things I usually order in one place, very efficient. Now its a whole ordeal every time I go to order. Super frustrating.",1,3,1610000046000,,,Walmart
d52b2ce9-a296-42db-9ae8-9feab322470a,"The updated version absolutely sucks, can't share from it, can't save to wishlist from it can't actually purchase from it. Everything sends you to the internet and then still can't add things to wish list.... hate to see it when Christmas shopping starts won't be able to get anything ordered.... go back to the old version was so much more user friendly",1,3,1634110232000,"Thanks for sharing your experience with us. We’re sorry you’ve had issues while using the Walmart app. We’ve shared your experience with our App Development Team. They release new app features each week based on customer feedback like yours. Make sure you check for app updates regularly.
",1635532643000,Walmart
9d654b31-214e-4b97-a845-4897229c04f3,"Random cancelations of purchases after I moved. New credit card. Doesn’t care. Make new account? Nope, associated with old ohone number, looks suspicious. No purchase. I will not buy a new phone just to buy a game. Order was not ready within 8 hours of setting it. Ended up buying the item twice. Just buy your things in the store, this doesn't save time and can cost you. Also disappointed with its lack of integration with google pay. Had to enter in credit card information just for Wallmart.",1,18,1701254290000,"We understand your frustration, and we apologize for any inconvenience you've faced. If you encounter issues with order cancellations or payment methods, it's recommended to reach out to customer support directly at https://www.walmart.com/help.",1701259411000,Walmart
3fce41e7-955c-411c-b3b8-f8d4ea29a853,"This new update is RIDICULOUS! I've shopped at Walmart exclusively for the last 2 years using the app for store pickup. NO MORE Walmart!!! My business will go to Krogers and Super 1. Update SUCKS! The design is no longer use-friendly for ordering for a local store ""pickup"". It's complicated and messy!! It seems the intent of the update was to combine all of the store & internet purchases into one cart, but it's bulky & confusing!!! Go back to previous version!",1,2,1631502276000,,,Walmart
f3ac7a00-4d73-4067-934e-c1ed636f1cf9,I have always used the pickup/delivery option long before the COVID pandemic due to having back/knee disabilities and have praised the service. Since the pandemic things are always missing upon delivery and it makes it hard when you planned a meal based on that grocery list and the meat is missing but you got the sides! Then you have to order $35 or more to try and replace that. It is starting to become frustrating. I may have to try another store for grocery delivery for a while.,3,4,1616966589000,,,Walmart
7c08970f-6c4e-4a9a-876f-914a938520f2,"I love the one stop shoppng ticket. Kudos! Now to a major issue for buying clothing while using the updated app: There is no sizing guide for people to go by. This causes a situation where a shopper is not given accurate data in order to determine an informed spending of money. To see if this error is across all groups, I shopped in all clothing departments, and all I see are future issues of returns, payments reimbursement, and over all lack of customer satifaction. This could be a quick fix.",3,0,1631592376000,,,Walmart
87dc4d37-78fb-4620-b5b1-3b8fdbbfae68,"Love grocery pickup and have been using the service since it started! Just wish the app hadn't merged online items with grocery pickup - it makes shopping way more confusing when trying to keep track of what is online vs. in store. Also, I still miss the dedicated Favorites section and don't like how every single thing I have puchased ends up in ""My Items"" - not everything I buy will be a repurchase so Favorites was way more convenient.",4,11,1638964174000,,,Walmart
43d56ddb-4ab1-4e97-b8af-0b1f39bad9fc,"This app has become useless with the latest update. There is no way to just look at grocery items, nor tell which items are actually on grocery pick up versus internet items. It can no longer even be used for grocery pickup.. It also does not sync with the website. I added stuff to my grocery cart online and my cart on the app is empty. It was pretty good before the update and now I have no use for it whatsoever.",1,2,1627443679000,,,Walmart
9da6ef69-dab4-4e02-b3c3-071eded30d37,"First time to order online from Walmart. Great experience! 3 deliveries needed to complete the order, with the first being the day I ordered and the next 2 before the scheduled dates. Text messages were sent along the way. This was sooo much easier then going from one Walmart to another to try to find what I wanted. Thank you.... You've converted an Amazon customer!!!",5,2,1680732467000,We appreciate your review and kind words. We are so glad our service could help you! Thank you for shopping with Walmart!,1680833524000,Walmart
a7b1abde-d1b0-4d04-bd8f-aa14c7ed4cea,"Why did you ""fix"" what wasn't broken? About four years ago the app was just right. Even then, you had groceries and all other departments combined, so that's nothing new. You had ""Categories"" that made searching easier. The shade of blue was deeper snd easier on the eyes. Overall the app was visually appealing and user friendly. Why did you change it?",2,101,1642370910000,,,Walmart
b5f9f903-41de-4252-a4a7-ee9367bc5fc8,"This app is ok. With all the issues that Walmart has given me inside and out of online shopping, I can't say I expect much more from them... When they're out of stock on an item, they won't list it as such until you click on it. Makes grocery shopping tedious when you need to click on every single item just to see if it's in stock.. As far as online shopping, I've had issues w/ people tampering with my items before sending them, or sending me items completely different from what I ordered....",3,3,1587341447000,,,Walmart
e6db836e-bbff-4d9b-8c39-24ac4ef9a948,"This app's GUI has improved quite a bit. W+ service is well worth the cost in my opinion. The substitutions are usually great, you can also opt out of them. The drivers tend to deliver the goods neatly and are attentive to fragile items. Sometimes orders are late but it doesn't bother me much. It is easy to track your order through the app also. Has overall been quite a pleasant experience.",4,64,1617616867000,,,Walmart
7ee4a7e3-698a-447e-a0f6-f3c64474269a,"On my Samsung device it only works in Portrait mode and then I can only see half of the Selections on the right. Please fix this So I can use It in Landscape mode and actually see what's being offered. I do however love the ability to choose favorites. ALSO, Walmart seems to be much better organized than other stores. The substitutions are often better than my Selections. They're right on time with my delivery.",3,25,1607980900000,,,Walmart
f1a32217-2154-419f-babd-89718f361892,"Sort and Filter stinks. Good pricing on most everything but if you want to find something to do with 3D printing, watch for the price gouging. Some people don't, and I'm hoping the customer service is as good as their price. The only reason I took a star from Walmart is they surely know that stuff is marked up double from another main online retailer.",4,3,1656830117000,"Thank you for sharing your experience with us. As you may have noticed, we are in the process of rolling out a new and improved app experience to make shopping easier. Please reach out to customer care at walmart.com/help for issues with pricing issues. If you have feedback for the app, you can contact us at https://survey.walmart.com/app.",1674711393000,Walmart
1e113106-8cda-47fd-8ce3-ee8e05caad67,"Last update took this from 4 stars to 2. The app now has so many features that it hinders your shopping experience. It made it harder to shop from MY store. It wants to ship everything to me from all over the country. Why would you ship me a box of fruit snacks from California to Iowa when my store shows them in stock? I just want to shop my store and pick up my items. Now everytime you search something you have to select a filter for ""in-store""..... each and every time for every item.",2,3,1626510407000,,,Walmart
f4bd1773-f757-427a-be40-8862a6ce1e21,"Currently useless for using with pickup orders I mainly used the app to check in when picking up curbside orders. But since the system changed to incorporate all online orders (pickup and shipping), weeks ago, it's useless. The app has not updated to the new system. Still has them separated out. And neither side will even acknowledge my recent pick up orders. When I started an order on the app, and tried to finish it on my computer, there was nothing in my cart. Useless",2,1,1630042440000,"Thank you for sharing your experience with us. We are always looking to improve the user experience. Please contact us at walmart.com/help

",1630361927000,Walmart
46ead304-fa65-461f-929d-9cc7afc488ee,"Made me go through that ""I am not a robot"" photo picking thing 9 times when I first started the app, then the first time I try to actually use it at the store, it makes me do it again. After 10 successive pages of different images, all of which I had done correctly, I gave up and deleted the app. That is ridiculous.",1,11,1536890692000,,,Walmart
7c326e29-765c-4726-8b8a-3f7d1c7bb64c,"Not a terrible app and I mostly use it for Walmart pay but it seems like anytime there's a solid feature, months later it'll be gone. Use to see what aisle an item was stocked at. Now, not a chance. Use to have a map of the store you were in and they eventually took that away as well. Kinda miss when the grocery/in person shopping app and the online shopping app were separate. Seemed to go downhill pretty fast after they merged the two.",3,0,1621770309000,,,Walmart
09d2bad7-76de-409e-9f24-84fa1f1e8580,"You took a good app and turned it into a frustrating cluster f$%k! Why would I want grocery items shipped to me and arriving days later, when I'm planning a dinner for that evening? You guys REALLY dropped the ball on this one. No one likes what you have done. I'm assuming the only reason this change was done, was for Walmart to make more money? No, you will be losing money, because people will go elsewhere to get their groceries and personal items.",1,3,1632683701000,"Thanks for sharing your experience with us, Laura. We’re sorry you’ve had issues with filtering between Pickup & Delivery vs. Walmart.com. We’ve shared your experience with our App Development Team. They release new app features each week based on customer feedback like yours. Make sure you check for app updates regularly.
",1635466868000,Walmart
db4aa367-0da6-401d-8e2e-8c2a5cc707ec,"The new update was bad enough in almost every aspect. I stopped using the app and would use my lap top because the two would not sync and the web page was still the old way and still easy to use unlike the updated app. Well, today I go to use the web site and it has now been updated as well syncing with the app and making it as rediculous as the app. I do not understand why they are not paying attention to ALL of the recent reviews of the update. Everyone is saying the same thing. Not good!",1,1,1631266707000,"Thanks for sharing this with us. We are in the process of rolling out a new and improved app experience. We're rolling features periodically and native list functionality will be coming soon. Meanwhile, you can create lists on the web or add items to the cart and save them for later. For assistance, please contact us at walmart.com/help",1633203751000,Walmart
adbb660f-cb84-47a5-9f02-d4aa0fe32797,The only good thing about this app so far is the barcode scanner. Using it to order groceries for delivery or pickup is like taking a gamble on whether or not you will get the items you actually want- either the item will be out of stock or the substitution will be disappointing. There's usually only one option to choose as a substitution and you can't add a note or choose which specific item you want instead. I'll stick to shopping in-store myself until the grocery shopping feature is improved,2,10,1608497802000,,,Walmart
0bb38b2e-a937-490c-b2dc-ecef65462deb,This app gets worse with every update. Prices sometimes do not show up unless you drill into a product. The option for substituting items is now more or less useless. You used to be able to select no substitutions for all and then enable substitutions for the few you don't care about. Now you have to manually edit each one individually. Don't get me started with trying to order stuff. All gallon and .5 gal milk shows out stock for ALL stores. But I can visit a store and they have plenty.,1,1,1664832079000,"Thanks for sharing your experience with us. We’re sorry you’ve had issues with item substitutions for Pickup & Delivery. We’ve shared your experience with our App Development Team, they are working towards bringing back this important feature! Please contact us at https://survey.walmart.com/app for any additional feedback.",1664834296000,Walmart
8d145e5d-3ddd-4594-a8fa-4a64e5bdc0cd,"So far garbage. You can't even open things on your grocery list to take a closer look you have to go and search that item again. They act like this merger was supposed to make things more seamless, but so far the app is janky and unintuitive in design. I already hate it and the functionality. You need to make it easier to look at and modify your list. Im hoping since it's new some of my issues are bugs... but i also cant add all the amts of items that i need. So thats weird and bad. Please fix.",1,25,1591217110000,,,Walmart
d3f9c88c-d23b-4976-b73b-5dc1bc96db21,The AI or algorithms have NO WAY to correctly decide how a Customer may want to acquire a purchased item. Removing the ability for the Customer to decide is a foolish design decision and should be reversed. The new app experience is not a good one. One thing walmart had over Amazon was the choice to pickup something and now that has been removed. Maybe someone could focus on filter and search which have always been implemented poorly by walmart. Put the Brand filter back.,1,0,1631760437000,,,Walmart
01fa3d10-9c29-445b-a420-eba2d58e439e,The app recently update. My save for later section is completely gone. I have looked everywhere for the items I had saved. This is so very upsetting because I had saved many things to purchase over time for my children's Christmas. Now it is all gone! This is beyond unacceptable. I am so very upset by this I can not explain it. This needs to be fixed. The old app was perfect! I dont understand why they changed it. Very upseting.,1,55,1631237839000,Thank you for taking the time to write this review. We are constantly reevaluating our design and always trying to create the best experience we can. Please contact us at walmart.com/help,1633055452000,Walmart
bb5b7241-84e0-44c4-81af-2381115c3e13,"gotta always search for rollbacks on Walmart app. then you really save. I've stepped away from Amazon recently for various reasons. 1). New prime membership fees, 2). Long shipping time if you're not a member, 3). We go to Walmart weekly so returns are easier than Amazon. 4). Price is nearly the same for many items and much of what you need is in the store.",5,2,1676963168000,We're so glad you love shopping with us! Thank you for using the Walmart app.,1676962298000,Walmart
6c38a471-14af-46ef-b4a6-cb833427137f,"Ughhhhh .. worthless! Downloaded this app for maybe 20 minutes & its trash can time as soon as this is written. Horrific presentation of item! If I click on an item, I'm wanting to read the description and know the details of that item. There shouldn't be a whole extra search for what I'm interested in ...!! Keep it simple and straight to the point. Don't make me swipe through 10 more things down the page before seeing what I want and then having to request to see it after I found it.. wow",1,2,1579508812000,,,Walmart
a1154f1c-fcef-4ad7-a931-709ff25d7d8d,"The Walmart app is really slow, and doesn't always do what it's supposed to do. It has taken me 2 hours to just find and order the things I bought today, and most of those things were reorders because I couldn't find the items on the app. I appreciate the delivery service, but I don't use it often enough to keep the monthly subscription. The delivery drivers and personal shoppers are heroes, though!!! Those folks get ALL the stars from me!!!",3,19,1621829126000,,,Walmart
9975dae4-1d0f-422f-b9a2-521fe3c2159b,Update:Great. Now with the latest updates i can't scan anything. Product not found. And if i type in the upc it just spins.... update was pointless and sucks. Just higher ups demanding change for the sake of change. And it causes issues. Its more confusing to use and now in store doesn't even show in store! I have to downgrade the app to actually use it to assist customers!!,1,18,1652495745000,Thank you for sharing. We are rolling out a new app. We're updating the barcode scanner feature for price checking items. For accurate prices while shopping at your local Walmart: Enable your precise location within the app. Then we can show you accurate prices based on which store you’re in. Contact us at https://survey.walmart.com/app,1654210088000,Walmart
26832abc-de28-41c6-b8ff-cc6d750bcf40,"This latest update has made the app almost unusable. As others have said, the favorites list is now ""buy again"", but it won't load, and keeps jumping back to the pantry. The new 'lists' are supposed to be sortable, but are not. It constantly glitches, lags, and randomly shuts down. PLEASE put it back the way it was! The favorites list needs to come back.",1,166,1609974333000,,,Walmart
30bf8233-937d-4eb5-9e31-f8449772bb8d,"Never had a worse experience, the curbside pickup is always a pain, the inventory is not correct, I've had to cancel orders more than once. It's always a terrible experience to check in to pick up, end up waiting 20+ minutes and asked multiple times the same information, my order is not showing as placed and it's not really user friendly.",1,0,1678334007000,Thank you for voicing your concern about our Online Grocery Pickup service. We would love to get more information into what happened. Please contact us at walmart.com/grocery/help,1678388461000,Walmart
fdfdba92-df17-4dce-815f-705f664c597f,I have been a user of the Wal-Mart pick-up for several years and had absolutely no issues. This is the first time I have tried to use this new app since the old one merged with it and it is ABSOLUTELY horrible. The app lags so much I had to stop attempting to add items to my cart. If this doesn't change I will not be using it. This use to take me on average 15 to 25 minutes to complete my order but now it is so frustrating I had to stop. PLEASE fix this or go back to two separate apps!!,1,3,1602105009000,,,Walmart
37d7a3f9-84ae-4907-a7e7-51b309e5d063,"Walmart really needs to look at the Amazon app, & try to copy it: Amazon is easy to read, follow, & use; with plenty of info on every product they sell, & if some info is missing, you can ask them by messaging & get a quick answer. Shopping is a breeze on both Amazon website & app. In contrast the Walmart app (& website) is a hot mess of haphazard layout of minimal info & having to choose an item if it's ""delivery"", ""pick-up"", or ""shipping"". (Some cannot be shipped (Why?)). It's a madhouse!",1,16,1640639130000,,,Walmart
