reviewId,content,score,thumbsUpCount,at,replyContent,repliedAt,appName
8d751970-fd04-4820-9bc3-ed67576f2adc,"I enjoy using this app for online purchases. But the in store inventory is never accurate. On more than one occasion, I have followed the app to the location of a product and stood there amazed that there isn't even an empty space on the shelf that would at least indicate the product is out. The app will show the store sells items that it doesn't. I like being able to add e-gift cards for easy in store or online use. And it's very convenient to use the barcode scanner in store to check prices.",3,30,1563339684000,,,Walmart
83de5280-b73c-434a-9bad-e4394ff6a934,"I do the majority of my shopping now with curbside, which is so convenient. But I had to uninstall this app because I kept getting unwanted notifications. I had notification messages set to off, and ads set to off. I didn't stay logged in. I kept getting the notifications. I contacted support and they couldn't do anything either. Now I just use the website instead.",3,0,1688807733000,Thanks for sharing your experience with us. We’re sorry you’ve had issues while using the Walmart app. We’ve shared your issue with our App Development Team. Please provide with more info at https://survey.walmart.com/app,1688808819000,Walmart
618839c8-818d-4ee7-b199-e51b9cfceee0,"App was great before the updates. The app updates took away the ""add to list"" and ""share"" buttons for items making it impossible for families to share lists and items from the app. Also the in store price scanning isn't correct anymore for sale items so you have to go find an associate to go through all sales items to verify pricing instead of being able to do that yourself. Fix that too! or bring the scanners back in store. Updates are supposed to make the app easier to use not impossible.",1,4,1634851884000,"Thank you for sharing your experience with us. As you may have noticed, we are in the process of rolling out a new and improved app experience to make shopping easier. We’re working on adding lists to the app soon. Meanwhile, you can still create and edit your lists on web. Please contact us at walmart.com/help for any additional questions.



",1643498616000,Walmart
5409c3a7-5c29-4fa1-9aca-d9023b5a708a,"It is beyond irritating to use this app now. Can't see the price at diff locations anymore. Have to go back, change your location, and search again. In-store, scanner is worthless. 95% of items scanned say barcode can't be found or that Walmart doesn't sell that item (even though I literally just picked it up off the shelf...) I don't know what midlife crisis Walmart is going through but since the update you can't even search for most stuff in clearance aisle but it's all full price",1,42,1632563466000,,,Walmart
f81b7221-152c-4068-ba14-185b804cf424,"The overall app is ok, however the new scanner function is complete junk, almost every item I try to scan in the store doesn't work, nor does the feature where you type in the barcode. The old app worked great, don't know why y'all had to change it but that's usually how things go. If it's not broke, it can be......",2,1,1635640592000,,,Walmart
418d69cb-3053-4b28-aaa0-65cea42fea20,"combining everything is great in theory- but you've given it SUPER lower functionality. I can't add to cart from the main screen. I have to hit ""in store"" on EACH search. It takes three times as long to shop bc of those two things. Make it so I can add to cart immediately, check a box for in store only for ALL my searches for this order unless I want to branch out. . AND check a box to hide out of stocks during my search if I want to. maybe I do.. Maybe I don't.",1,1,1632510661000,,,Walmart
31828736-c2d0-4cc2-81ba-cfa137be6c0d,"This app is never right. I have driven to several stores, some great distances from me, to find items it says are in stock. Nope. Never has been correct. Get there to be told they dont have any. This has happened multiple times at multiple stores. You can't call ahead to the store to ask either because no one knows. Almost worthless. The only thing that is useful is the barcode scanner for price checks.",2,2,1541733748000,,,Walmart
2e66275b-1194-4fde-887c-3323312c654b,"This update is garbage. I can't see any of my surrounding area stores to check prices anymore. Nor will it even scan anything. Keeps telling me it can't find the item. 🙄 To be fair, I think that combining the two was a mistake. I don't want to log into the grocery app to buy clothes. I don't want to log into the regular app to buy groceries. They both served their purpose. Although the layout is much cleaner looking, it's cluttered.",1,1,1631510625000,,,Walmart
dec0a420-22f2-40e7-9061-7ee087bc3983,"This app is not user friendly as the previous version. It helped me get an idea of whether the items were in stock before I even made the 45 minute drive to the store. To top it off, walmart took out all the scanners from their stores and now we have to pay $12.95 per month to use the feature when it was previously free. Come on! There's nothing useful a out this app.",1,6,1632998509000,"Thank you for sharing. We're rolling out a new app. We're updating the barcode scanner feature for price checking items. For accurate prices while shopping at your local Walmart: Enable your precise location within the app. Then we can show you accurate prices based on which store you’re in. Contact us at https://survey.walmart.com/app
",1636745387000,Walmart
7a5c07c0-2173-4a93-b045-0be133553ed0,"HORRIBLE!!!! I enjoyed ordering Wal-Mart delivery for my groceries with few problems. Now.....it's a nightmare not user friendly and very confusing. The previous version had deliver/pickup separately from online shipping. I used to be able to quickly and easily order my groceries for store delivery and almost always get them the same day, with no problems. Now, the site is slow, the delivery times are always only available the next day or later, many items I order often are out of stock often.",1,26,1636407732000,"Thanks for sharing your experience with us. We’re sorry you’ve had issues navigating the Walmart app. Please provide our Mobile App team with more info at appsupport@wal-mart.com
",1638206676000,Walmart
611a9c75-bb5a-4ab2-8fb8-f719e7f3186a,"The ""press and hold here"" every time I open the app is even worse for usability than Walmart pay buried in the menus. This is what you get when the executives - not the designers - make the decisions. Two apps that were fairly well developed combined into one kludge that is way worse than the two separate apps. Edit: The ""press and hold"" went away, and at least Walmart pay is now a button on the main screen. Added 2 stars.",3,4,1625131341000,,,Walmart
9a36b510-5452-446c-96d6-6c3c024f2ee0,"There are a lot of bugs, the pickup check in button wouldn't work for us, the idea of grocery drop off is great but the execution wasn't so much. We were missing 9 (in stock) items from our order. Also, Walmart asks for your feedback, but the app is so buggy that after you click how many stars you want, it assumes you're finished and takes you to the next page so you can't leave feedback. I asked to live chat with them about our problems, and they said it'd be a 21 min wait....then 24...then 30.",2,0,1589438083000,,,Walmart
8c3ccce0-a6e9-4667-bc77-fb42e76ef585,"New update is absolute trash. Designing the app to incorporate pushing a Walmart+ subscription is manipulative and a total fail!!!! Update is not user friendly and focusing more on pickup and groceries. When it should focus on store inventory-- which is the main use of the app.. Considering the demographic using the app, complete fail. Revert it.",1,3,1631240897000,We are sorry that you faced issues or the app is not working as expected. Your feedback really matters to us and would like the opportunity to address your concerns. Please feel free to contact us at appsupport@wal-mart.com with additional details and/or suggestions.,1633117238000,Walmart
6fa97c62-70fd-441c-9e67-d3b87347f3c8,"Crashes and/or freezes every 10mins. Also keeps removing added items from the cart CONSTANTLY! ******Even worse with the update!! Can't add items to my cart, I get ""sorry, technical difficulties, please try again later."" When i try to check-in on my way to pick up an order, SAME MESSAGE!! For 2 days now. Luckily, other grocery stores have online ordering as well... without the BS! See ya wally world!!",1,15,1634982712000,"Hi there, we are sorry to hear that the Walmart app is not loading properly. We suggest you try a forced close or shutdown of the app, and then re-launch it again to make it work. If you are still experiencing loading issues, please contact us at https://survey.walmart.com/app. Thank you.",1649895911000,Walmart
7b5dfd41-dbe2-4a2d-ba1a-df446bde466a,"The Wedding Registry sucks! I chose to register with Walmart bc his sister works there & I knew it would be an affordable shopping option. People complained that they couldn't print it in store, and even specifically asked me to also register with Target for their convenience. As the registry manager, I can't get the app to save items as having been bought. The only way to ""check them off"" that I've found is delete them from the list. That's not productive! This should be fixed for future use.",1,6,1608648073000,,,Walmart
aea31244-6063-48e4-afee-29bb17878e35,"When i first started using this app, which has only been about 4 months, everything was sooo great!! Worked perfectly every time. For whatever reason it doesnt work anymore. It doesnt load all of my previously purchased items any more and wont let me add more items to my cart after i reach about 25 items. Its sooo slow now. Takes forever to complete an order so i have to give up. Uninstalling because its obviously happening to others too and not a problem with my phone.",1,25,1612147437000,,,Walmart
e429e6d4-8b77-4ec5-b0b7-0cca76e1e9a5,Sometimes things shouldn't be changed. The old app was great. This new app you scan things and not 1x does it give you the right price. I like to know how much something is before I actually go to the register. I can scan something n it say not available but I'm scanning it. Can't enter bar code manually either cause it's the same thing. I scanned something now and it said $24 and it was actually $11. This is the worse app ever. Would be wonderful if you would just bring back the old app. HORRIB,1,8,1632004533000,,,Walmart
4fcc29b4-ece6-465e-8cc0-12a63959ae0a,"The new, merged update is awful. You can't select to shop just ""in-store"" only but need to select that option for each and every item. And they've taken away their store map so have fun walking in circles trying to find the correct aisle since their store layout is bonkers. I'm sure I'll find additional issues with the new update but this was just after 5 minutes. Major fall, once again, Walmart.",1,3,1632256343000,"Thank you for sharing your experience with us. As you may have noticed, we are in the process of rolling out a new and improved app experience to make shopping easier. To enable this, we are rolling features periodically and the store maps feature will re-launch on the app very soon.
",1635203247000,Walmart
8d0b2474-7ca5-4766-96d2-1c9275bf6dd7,"What happened to this app? This app is unusable now. I got so annoyed I went and got my laptop, only to see that things I saved on the app weren't there when I signed in on my laptop. Horrible update. Worst update I've ever experienced. Search results are horrible. The combined grocery and warehouse carts is ridiculous. Finding local availability isn't there. Just horrible all around. I can't shop with this app anymore.",1,1,1627362697000,,,Walmart
1f863a02-6dcd-48eb-9bee-165b9e8e912f,"Update: 02/2019 - A few things have changed and not for the better. Now you can't add any paper receipts into Savings Catcher which removes the incentive to shop exclusively at Walmart-including grocery pickup. Very disappointing! Also, every time I use my fingerprint to login to Walmart pay it makes me use my PIN anyway, so what's the point of offering fingerprint security? I used to love the Savings Catcher program but now it's just a gimmick. In store pickup is great, everything else just ok.",2,2,1549848912000,,,Walmart
19d93e1d-b869-45b0-afd7-66f6fb1769f0,"What the hell did you do walmart? I hate this new update, How freaking confusing! And counterproductive. Change it back! I absolutely hate that things are lumped together now. I like grocery separate from online. I used to be able to add things I ran out of in my grocery cart until I had enough for an order. Kind of like a grocery list u keep updating. But now if I want to buy something online I have to take all food items back out of the cart to do just a online order. Sucks!",1,7,1634186939000,Thanks for sharing your experience with us. We’re sorry you’ve had issues while using the Walmart app. We’ve shared your experience with our App Development Team. They release new app features each week based on customer feedback like yours. Make sure you check for app updates regularly.,1633391827000,Walmart
33bf7731-2804-4cc2-8665-d9158caff1da,"This app is very frustrating. From the search algorithm, to out of stock items, it definitely needs work. My neighbors across the street can get deliveries, but it says my address is undeliverable. I live in town! So I use their address and put directions in the driver's note. Lol Third party items and their shipping are ALWAYS outrageously overpriced. It also automatically charges you $15 for a tip on deliveries. You have to manually change it.",2,2,1657572224000,,,Walmart
0ae48605-53ed-444d-a2e5-6d1882370261,"This app is useful up until you try to checkout! I've never been able to checkout using this app, I ALWAYS HAVE TO USE THE WEB! Only good for price comparisons and helps to make shopping in store quicker because it displays the aisle number to find items in... that's it, if I can't checkout... what's the point?! Edit: since my first review of the Walmart app, it has improved 100%!! The checkout process is quick and easy, but the most important thing is that i can complete checkout now! 10//07/2021",5,2,1633669775000,,,Walmart
c16ed57f-5044-4d3f-aff7-02142357c4b6,"This app is so bad. It used to be good back when they had a ""favorites"" section but they changed it to ""my items"" and now it shows everything I've ever bought. You have to go to a separate screen to remove items, which doesn't even work. It's not possible to scroll through the entire list, it always gets hung up. Sometimes it will say ""item not available for delivery"" when I'm doing a pick up. There's too much wrong with this app to fit into 500 characters. Sick of it.",1,32,1612065802000,,,Walmart
080120a1-45a0-4779-a870-89e14384e4c2,"Even if you filter to only shop for items fulfilled by Walmart, you'll still get items fulfilled by ""trusted partners"". The substitutions for delivery orders are random. They'll substitute for some things but not others, and often that out of stock item is the one thing you need- even if there are similar items available in the app. There's no way to communicate that you want a substution if it's not offered. Definitely not worth the subscription price, I'll stick to Amazon Fresh.",1,169,1704315511000,,,Walmart
7f517e07-1c49-430f-90d7-3c123792ed61,"This updated Walmart app is HORRENDOUS!!!! I can no longer access my ""favorite"" foods/items. I have to access my lists through the website, as they are no longer available through the app. My pharmacy/RX info can't be accessed now either. I can't just choose pick-up when shopping. I have to select it every time I look for a new item, as opposed to shopping like that from the get-go. This is hands-down the worst ""improvement"" I've seen with an app. It makes me NOT want to shop Walmart at all.",1,23,1632732222000,"Hi, Amanda. We're in the process of rolling out an improved app experience. We're rolling features periodically and native List and Pharmacy functionality will be coming soon. Meanwhile, you can create lists on the web or add items to the cart and save them for later, as well as fill your prescriptions. For questions, reach us at walmart.com/help.",1635632105000,Walmart
f2020503-428e-4ec6-a389-c1a2ae601255,"So far so good! I've had a lot of issues with this app in the past. When I first got it, it was great! But then an update (well several updates) for at least a year, made the app basically unusable. It would take forever to load and then when it did load most of the time it would force close, making me have to start the process over. But I decided to give it another try and whatever was in this last update worked! It now opens perfectly and I haven't had any issues with it so far!!",5,71,1682882820000,Thanks for sharing your experience with us. We’re sorry you’ve had issues while using the Walmart app. We’ve shared your experience with our App Development Team. They release new app features each week based on customer feedback like yours. Make sure you check for app updates regularly.,1676002979000,Walmart
765df219-d891-4fbf-8238-79eaa428bd8c,but when it doesn't it's hell. I've haven't been able to redeem my funds to use & the options for customer service are a joke. You send feedback & hope someone gets back to you. Starting to become super annoyed. Edited 9/17/2021: This newest update now makes it impossible to add items to your list. You either have to add it to the cart or buy it now. Seeing how Walmart has stopped doing layaway for at least the holidays I'm not surprised. I'll be deleting the app from my phone today.,1,2,1631934540000,,,Walmart
c1536055-dc88-4742-8753-ec41aba4d0ad,"Don't accept the new update. You will lose your current cart. Your pickup/delivery and shipping carts will be combined making it harder to manage separate orders. There also ads now, and a million ""suggestions"" (really ads) forcing you to have to scroll a lot before getting to product information you need like the ingredient list, for example. Go back Walmart. Your old app was way better. Your updates are inefficient, actually offensive, and overtly anti-customer.",2,0,1632913957000,Thanks for sharing your experience with us. We’re sorry you’ve had issues while using the Walmart app. We’ve shared your experience with our App Development Team. They release new app features each week based on customer feedback like yours. Make sure you check for app updates regularly.,1636327720000,Walmart
1309aada-811e-4938-a695-e789cd73caf4,"This app and website used to be great!! The separation between grocery pickup and the regular site was great! Now that they have combined the 2, it's absolutely awful!!! I have been contemplating switching to Fry's or Safeway for online grocery shopping since they have combined the shopping. I mean I ordered groceries last week and 1 item was delivered to my house, you have to comb over your entire order before submitting. Huge pain in the butt!!! 🤬",2,44,1633948966000,Thanks for sharing your experience with us. We’re sorry you’ve had issues with filtering between Pickup & Delivery vs. Walmart.com. We’ve shared your experience with our App Development Team. They release new app features each week based on customer feedback like yours. Make sure you check for app updates regularly.,1635342598000,Walmart
de018f7f-20a3-4b51-95fd-803d6205e5c2,"Instructions for curbside pickup are to download the app ONLY to tell that you have arrived. Get to the site there are six poorly marked spots and the app allows the user to select ""1"", ""2"" or ""-"" with no ability to type a number in the ""-"". Then to top it off only one of two items I ordered was there for pickup. Would give zero stars if I could.",1,1,1641267521000,,,Walmart
c0d2534e-cfaf-4f62-9130-90d4bf6f6560,"I'm rating the APP and not the people who pick and load. I typically order 100 or so items every few weeks in one bulk order. when my order gets to about 50-70 items the app seems to slow way down. if I exit the app and then force close it then return to the app it sometimes solves the issue and other times it just stays slow. thinks like incrementing a quantity, I click and wait sometimes up to 15-20 seconds. it's bazarre behavior. like it's related to the number of items in cart.",2,0,1617647122000,,,Walmart
24192244-0a50-49b4-bca6-814ffedeae06,"Downloaded to check TLE updates, which it states can be done on the tag. Scan, app says function not yet available (false advertising). Then it sends unnecessary push notifications just to give ads, such as ""Our app's all that!"", as ""high priority"" with sound. False advertising, unwanted advertising, and just a bad time, reminding me why I uninstalled it before: forces you to try logging in every time you use the app or even scan!",1,0,1632089938000,We are sorry that you faced issues or the app is not working as expected. Your feedback really matters to us and would like the opportunity to address your concerns. Please feel free to contact us at appsupport@wal-mart.com with additional details and/or suggestions.,1634161257000,Walmart
6295c1f5-ab50-4f37-988f-a33824e65a4a,"The update is no good! You can't scan the clearance items. This wasn't a typical issue in the past. I have trouble with regular priced items too. Now I need to check the price at the register (which is inefficient with long lines and an already stretched-thin staff in most stores.) I like the old app as it knew which store I was in and showed the prices specific to each store, not just the online price. I have left a store twice now, discouraged by this app's malfunctions. Restore the old app.",1,1,1634764147000,Thank you for sharing. We are rolling out a new app. We're updating the barcode scanner feature for price checking items. For accurate prices while shopping at your local Walmart: Enable your precise location within the app. Then we can show you accurate prices based on which store you’re in. Contact us at https://survey.walmart.com/app,1643155183000,Walmart
5523891f-019e-45e3-a3a7-4278fdf673a0,"PROS-The choose-your-model feature is wonderful! The ability to scan receipts to your account to keep track is very helpful. FINALLY, the simple feature of searching for a product by brand name is available. CONS-You should be able to filter by how you get the item; i.e: shipping, pick-up, etc. Not EVERYONE is able-bodied. I didn't realize that U CAN'T EDIT A REVIEW?! I thought that was standard for ALL apps. WTH! Amazon is the better option for convenience.",4,113,1704820810000,Thanks for using the Walmart app! We're happy to hear positive feedback on our barcode scanner feature. We appreciate you taking the time leave us a review.,1668737110000,Walmart
8a151503-8a04-44d7-b5ad-13bee6679f47,"This app is far inferior to that of other services such as Instacart. 1. Notifications are indicated in email or on the app icon, but clicking the icon does not show any notifications. 2. Substitutions are final. You can't edit them, you can only return. 3. If an item is out of stock, there is zero opportunity to select another item (for example, another size of a product) 4. The main app menu forces you to pick a shopping option or go to the fuill account menu regardless of order status. 5. Orders do not show up under the right place if made from the web 6. The app says check in when you are on your way, but when you click ""check in,"" what they really mean is ""check in when you are at the store."" This could be SO much better with just some basic UI/UX improvements. In general, whoever wrote this should look for a different type of job. There are exactly zero ways this version of the app could have won awards.",2,23,1595053300000,,,Walmart
e962dc24-4c97-468f-b1fd-4e5d3871281f,"If I could give zero stars I would have. I've been using the Walmart app for years and this update is completely terrible. Virtually everything scanned in store comes up as 'barcode found, but we don't carry this exact item'. They are literally on your shelf! I Rarely had this kind of issue before the update. This problem makes using the app frustrating and useless.",1,5,1631595486000,,,Walmart
750666b4-8809-4c91-a9ab-0adc5f16005f,"The new app is a complete disaster! Using on a cell is a nightmare. The old app was easily navigated, the new one is clumsy and a clunky to navigate on a cell. Impossible to check various store inventories in search of 'out-of-stock' items. To interface with pharmacy you are directed out of the app to a juvenille Internet page that does not properly load on cell phones neither in portrait or landscape! It's even messed up the pharmacy texting system. Switch to AMAZON until a new CIO is hired!",1,19,1633308691000,"Thanks for sharing your experience with us. We’re sorry you’ve had issues navigating the Walmart app. Please provide our Mobile App team with more info at appsupport@wal-mart.com

",1638887169000,Walmart
126b7215-a5e7-4d43-a51f-cb9f0e25faea,"This app is unusable. Its glitchy, and constantly tries to force me to remove items from my order because they aren't available for delivery. The only problem is I'm picking the order up. And if I back out to try over again , it wants to remove a completely new batch of items for the same reason. You get one hour to check out, but I didn't make it last time. I spent an hour trying to get it to accept my order, and lost my spot.",1,2,1594073606000,,,Walmart
