reviewId,content,score,thumbsUpCount,at,replyContent,repliedAt,appName
aeb4850b-7dc8-4a39-8ebe-0fd4589dfa64,"Constant reminder to restart the Walmart subscription! STOP. If I want to restart, I will. But the full page annoying reminder is enough to uninstall this app!!!! Update: this is a very invasive app. You can NOT use curbside pickup without sharing precise location. Plus the stock availability is wildly INACCURATE!!! AND I HAVE COMPLETED NUMEROUS SURVEYS WITH NO RESULTS.",1,6,1716065896000,"Your input is valuable to us, Renee. We're here to enhance your experience. Please provide us with more info at https://survey.walmart.com/app",1713753980000,Walmart
2d72c00a-8621-4f9d-b1e6-7768c1de6a24,"They trashed the online ordering & pick up. It used to be so easy to find everything you needed, but they cluttered it like crazy. After 10 mins, I had 4 items out of the 50ish I'd normally buy. The new app design literally makes it take longer than actually shopping. Worthless. I can't even imagine how many customers gave up like myself. Thankfully Meijer & Hy-Vee & jewel have better options.",1,67,1709438037000,Thanks for sharing your experience with us. We’re remorseful to know about the issue you faced while using with the Walmart app. Please contact us at walmart.com/help.,1709439662000,Walmart
c0cc7527-dc7b-40d4-a5ce-56b20075ca93,"App is somewhat ok, delivery service is trash. Not worth the membership 4/5 orders get delayed after they're marked as ""on the way"" for over an hour and you dont get a refund even though you paid extra for faster. appointment for them to be there and its always 2 + hours later so if you have something planned you have to cancel. Not to mention they never get the order right, always getting charged for things that didn't show. Also my account was hacked before so I wouldn't say it's secure. 👎",1,136,1714174460000,Thank you for voicing your concern about our Online Grocery Pickup service. We would love to get more information into what happened. Please contact us at walmart.com/grocery/help,1669938068000,Walmart
6ce56d23-5250-4906-8004-754fb210f6bd,Old Review correction after 2021 update broke in-store functionality: upgraded from 1 to 2 stars. In-store use is hit or miss. For a while you could find local stock and pricing at different stores if you dug in the product page... Missing that is a huge loss. Currently in-store scanning works sometimes: occasionally it still will only give online pricing. Force quit and restarting the app 6 or 8 times usually fixes the issue. I just downloaded the 4/24 update so we'll see if that helps.,2,152,1713495095000,"We'd certainly like to look further into the issues you mentioned, Julia. Please connect with us at https://www.walmart.com/help",1713496439000,Walmart
55e1f518-4aed-47db-8309-cb522bfe110e,"Works great, love the scan-n-go feature but hate that you still have to wait in line and go to a register to checkout. Have it work the same as Sam's Club and it will be perfect. The grocery delivery side, however, is honestly fantastic. Gas fill-up seems a bit glitchy recently though - seeing if there are any app updates that I missed.",5,0,1710711847000,"Thank you for sharing your experience! We'll certainly review your suggestions for streamlining the checkout process and improving the gas fill-up feature. If you have any further questions or need assistance, feel free to reach out. For more insights, please visit https://survey.walmart.com/app.",1710715190000,Walmart
32f27735-7d73-4a0e-b8e7-27558eea7480,"App works well. Good job software team. One feature is Missing with app. I wish that when shopping (In Store) mode, they give you options to show other locations that may or may not have inventory of a product I have to use Google to find out and takes time, because we links jump you back into app with (saved store location) that doesn't help. usually resorting to using the computer.",4,34,1714021146000,Thanks for the praise! We'll consider your suggestion for app enhancement. Please get in touch with us here: https://survey.walmart.com/app,1714022802000,Walmart
cd26deed-bd96-4ef9-bd78-d386401377ca,"I like the Walmart app. I LOVE being able to pick-up my groceries and it works great for that!! BUT... when I get a Walmart email and look at items listed, it says I can add to cart to order. But, when I open the app from the email like it says to do, and look at the same items...99% of the items listed are OUT OF STOCK...WHY?? AND....This last update, the app is adding all kinds of items to the ""my items"" list, for me to choose from... I don't like it one bit!!! 😕 AND NOTHING HAS CHANGED ‼️",3,7,1710903853000,Thanks for sharing your experience with us. We’re sorry you’ve had issues while using the Walmart app. We’ve shared your experience with our App Development Team. They release new app features each week based on customer feedback like yours. Make sure you check for app updates regularly.,1685074612000,Walmart
4a5c5740-454a-4b87-b23c-d5e9fd4aae5b,"Mostly okay. Scan-and-go needs work. Scanning produce was so confusing at first and they don't make it clear in the instructions. Also, not all stores are the same, some have produce scales nearby while others are weighed at checkout. YOU CAN'T ADD GIFT CARDS as a payment type for scan-and-go, which is unbelievable. How do you use an e-card in store then? Barcode scan can be slow. Doesn't always stay at YOUR STORE, which can cause you to buy something for pick-up from the wrong store.",3,147,1712261855000,"We'd like to take this discussion further to our DM's in order to have a more detailed one, Sam. Kindly connect with us at https://www.walmart.com/help",1712213879000,Walmart
7035a77d-e8e4-491e-b564-f4b123ea52a3,"After the newest update, I am no longer able to get my fuel discount at Mobil/Exxon stations. It pops up with the option to start fueling, but when I try to click on it, it does nothing. I've restarted my phone, uninstalled and reinstalled and still won't work. Only reason I gave 3 stars is because the rest of the features appear to work fine.",3,83,1709325145000,"That's not the experience we wanted you to have with our app, Lizz. Please tell us additional details about it at https://survey.walmart.com/app",1709325851000,Walmart
6393ea61-e279-447a-b28c-77987fdd23d1,"Was loving the app, not so much anymore. I have been doing my grocery shopping with Walmart, and having it delivered. It was great! But then my last several orders I've noticed it always says "" These items are not eligible for substitutions "". Why? Why did you take away the ability to choose substitutions? Now if I place an order and something is out, instead of a substitution, I get nothing, which means I may have to do another shopping trip to another store to get my missing items.",2,8,1715886782000,Thanks for bringing this to our attention. We'd like to investigate the issue. Please contact us at walmart.com/help,1715888638000,Walmart
2522e201-92f9-456b-bf44-86d1bd735fbb,"This is very convenient to use. I always check for out of stock items, but most of the time, my order is missing something because it is out of stock. The other issue is getting the wrong item delivered. Mostly, this happens with produce. The people making the delivers are always very professional and great.",4,1,1714305721000,"For further assistance regarding the issue you've encountered, please reach out to us through our support portal at https://www.walmart.com/help. We're here to address your concerns and provide prompt resolution.",1714307577000,Walmart
c79f37f8-b5f2-4d0d-a14c-caff1f31ab4b,"It's stupid how they claim items are in stock, and you go to the store and they don't have something. Worse, the prices are incorrect and/or not matching. You add an item where they want to charge shipping from the store, but online it's free; then it still gets delivered from a local store. We tried ordering things for our store pickup and waited in the parking lot for several HOURS. As for the application, we aren't allowed to change comments on items purchased. Why???",1,26,1712575382000,Thanks for sharing your experience with us. We’re sorry you’ve had issues with product availability within the Walmart app. Please contact us at walmart.com/help.,1682880977000,Walmart
fffe7589-ca04-454b-82b0-7827f28889f5,"Everything has been really great with the app. Customer service has been amazing too. The only complaint I have is, my apartment isn't the easiest to locate and so I will use the chat with the driver option to give them the right directions to my place. The drivers rarely ever look and they spend way more time looking for my apartment then they do actually shopping for my stuff lol. Walmart can't really do anything about that, though ☺",4,43,1709269257000,,,Walmart
1f318b32-a453-4bbc-a686-b8d37c4b057e,"When I try to filter the price low to high, it prioritizes best sellers over showing me the best priced items. It even hides many items from my view in order to show me their best sellers rather than what I asked for. I actually had to use Google over the app to even find certain things, because even when I search for them in app, they don't show it.",1,46,1713157820000,"Thank you for sharing this idea with us, and we request you to sharing your details with us at https://survey.walmart.com/app",1713160453000,Walmart
8ddf7ffe-6a15-423c-a94e-c7d55e582a43,"Walmart+ is convenient, but I've had a couple of issues receiving products, they drop off at the wrong home, and when I chose the option to sign for my groceries, they leave sitting at the door anyway. That there is inconvenient, I would rather tip for my delivery in person. It doesn't make sense to tip before receiving merchandise.",3,19,1710360878000,We regret to hear about the delivery hiccups. Your words are crucial for us to refine our service. We appreciate your patience and are committed to making your Walmart+ experience better. Please contact us at walmart.com/help,1710362024000,Walmart
83a8888b-bc5b-4e44-94d7-37c2aef77895,"4 stars only from deliveries left away from front door. This doesn't happen often, but it's why I tip after delivery is made. I'm disabled. Leaving my groceries at bottom of stairs isn't what I pay for. Nor taking a pic from parking lot which doesn't show my porch. I do take picture if it's done wrong and report it. Walmart is very firm about deliveries. I've often gotten refunds or discounts due to lazy deliveries. However 90% of the time the drivers are super awesome, friendly and helpful!",4,26,1710983173000,"Your satisfaction remains our utmost priority. To provide you with a personalized and tailored assistance experience, we encourage you to connect with our dedicated support team at walmart.com/help",1710989749000,Walmart
fddc5011-89d7-4a49-b9a1-d2374f2a4bb3,Was told I could ship it to a Walmart with a Auto shop as long as I set it as my default store. Wrong. Also I don't like that I had to save my card. I also don't find the app super user friendly. If they don't install my battery I will be pissed. I never saw the option to choose that either. Not impressed at all.,1,0,1722345875000,"Olivia, we're here to help you. Let's work together to address your concerns step-by-step. Click here https://www.walmart.com/help for further support.",1722396671000,Walmart
30674759-8052-4605-971b-dea53b2b0cba,"QR code scanner never works at the pump. Every time I have tried, it tells me there is something wrong with the address linked to my payment card...but I can use the aame payment card with the same address to order something theough the store or marketplace. Additionally, the app's search engine usually puts the item I am looking for on page 2 or 3. More frustration than I care to deal with.",1,26,1711584675000,"Let's tackle these challenges together! For assistance, visit https://www.walmart.com/help. Your satisfaction matters most.",1711590694000,Walmart
546268bc-be79-4c0a-b756-338ef27b00e0,"I'm a walmart + member & have had multiple issues with my purchases using the app. Items received were defective clothing, counterfeit lotion, ""lost items"" & most recently purchased a lawnmower on 3/23 during a flash sale & still haven't received it. I've reached out multiple times with nothing being resolved. They claim to offer solution""s"" but its more of an ultimatum, either wait for it or get a refund.. I want the product I paid for, at the price that was advertised.",1,56,1714442048000,"Rolo, we'll do our best to ensure your concerns are addressed promptly. Reach out to us at: https://www.walmart.com/help",1714442994000,Walmart
7ad4696b-c0e6-43be-b117-a232b9ee35de,"Most of the time I have no problem with my home deliveries, but when I do, the problem is super bad. I believe it's not a Walmart problem but a specific store problem. I will Kee my Walmart+ subscription as long as it's offered. Nothing is perfect, and this is the best thing going on, human errors and all. I highly recommend.",4,0,1715348581000,We'd certainly like to look further into the issue you mentioned. Please connect with us at https://www.walmart.com/help,1715351961000,Walmart
a4fd0a23-aa6c-4e9b-8184-2759e90f06e9,"Okay, I'll put it this way. I was looking for a product on the app and It gave me the aisle number; but the aísle number was on top a refrigerador, not visible. It took some minutes to find someone to ask! Some times I go to other stores I'm not familiar with and the products aísles are located in different than others; so it takes more than to find whatever I need. It'd be great the app to have a little map with section names to locate them. Example: Pet supplies, cleaning supplies, etc.",3,15,1713562072000,That's not how we expected your experience to be. We recommend you share more details directly with us at https://www.walmart.com/help.,1713554130000,Walmart
67f1ac62-8841-484a-b011-b707fa747151,"Walmart is the largest Grocery store within 10miles of me. I signed up for Walmart plus when it started and have continued using it for grocery delivery as it saves me the trip to town (6miles). But I have recently started questioning the value. MANY times the app shows items out of stock. These are typically the cheaper, generic or store brand items. YET when I drive to the store those items ARE in stock. Now this week, many items were ""in-store"" only. Why pay for a subscription?",3,1,1712908421000,"We understand the issues you've raised and are dedicated to improving your experience with our platform. To better assist you and address your specific concerns, we invite you to share more details through our dedicated support link at walmart.com/help",1712911298000,Walmart
82455cb7-3112-4a1c-91cf-3d5b124900cd,"Very useful app. Three suggestions: Don't show me out of stock items when I search. Don't refuse to let me go into the app if I don't want to update. Don't say I have messages, when it's just an ad. You shouldn't even have ads!! Walmart is one of those stores that won't give you the option to NOT save your card (-600 stars, but that's the company, not the app). This app makes it easy to delete the card after an order, as long as you can find the saved payments spot.",4,8,1715632934000,"We appreciate your support! If there's anything we can assist you with, don't hesitate to contact us at Walmart.com/help.",1715633739000,Walmart
c39ed70e-d788-4cfd-a754-6ca67c6f91cb,"I notice my total is different the next day every time without any changes to my order. This week it's $1.40 higher today than it was when I placed my order. You have 0 correspondence to anything I've ever said as feedback. I get a noti saying let us know to ship the item by 2pm. I click it, it says shipping is unavailable on that item. Yet. I notice the price hasn't been refunded. So. On top of the $1.50 per week you upcharge, now you're keeping money for items you can't ship?",2,11,1708886104000,"We've taken note of the concerns you've brought to our attention and are dedicated to enhancing the user experience. Should you require further assistance please feel free to reach out to us at walmart.com/help
",1708887387000,Walmart
75b6355e-5a25-48ec-972c-731333bb0f4e,"Walmart pick up feature is troublesome. I have had problems with it in the past. Most recently it doesn't appear to be processing correctly. If I check in, park and enter my info, the app doesn't clear the icon on my desk top or the dot (flag) in the app. They bring my order out, so the store is receiving info correctly. I just can't get the phone notifications to clear. Creates confusion. You wonder if you truly got check in or need to try again. 🤷🏼‍♀️",4,190,1711091330000,"we sincerely apologize if things didn't go as smoothly as expected. If you need assistance or have any concerns, please reach out to us at walmart.com/help",1711092411000,Walmart
fdb9c8d7-dc49-4b53-b4cc-bb801bdb0c74,"The search function is driving me nuts. I typed in Blu ray player. Scrolled through the options, found one at the price I was looking for from an acceptable brand, ordered, and picked up some time later. As I am putting the box in the recycling, I see it is a DVD player, not a Blu Ray. Why was it even in the list? Not the first time the website led me to a product that was not what I searched for.",2,44,1715500907000,This is not the experience we want for our customers. Please contact us at https://survey.walmart.com/app,1715502566000,Walmart
c5097fd5-81c2-40fc-91f5-abf721bb39b0,"3.35 stars: The app is functional, but sometimes you have to tweak what you're searching for several times, which can be tedious. The filter doesn't stay at whatever you select, and the default is always at the highest price. I can't stress enough to look at the seller information for non- Walmart provider purchases. if the seller is below 85%, would not attempt. You may have to pay an additional fee, which I absolutely will not do. I wish looking at your order information was easier as well.",4,66,1715661257000,"We're committed to ensuring your satisfaction. If you have any suggestions or need assistance, please don't hesitate to reach out to us at https://survey.walmart.com/app",1715661855000,Walmart
d12acafa-408c-42b8-ab1d-4ead8cd23fec,I'm loving my new subscription to Walmart + and all my extra benefits. Being that the APP CRASHES all the time I'm only rating it at 3 stars. I'll be happily doing some grocery selections or even any other miscellaneous browsing and shopping and next thing ya know that lovely error message pops up saying Walmart has stopped 😭😡😮‍💨 other than this extremely frustrating issue... I am ever so grateful for my subscription to Walmart plus 🙏 oh and one of THE BEST PERKS=FREE DELIVERY!!!,3,7,1715252631000,We aim to address and resolve the situation for you. We encourage you to contact our dedicated support team at walmart.com/help for tailored assistance.,1715275191000,Walmart
55570b66-f214-48d1-93c5-ea62449c4994,"You'd expect a shopping app made by WALMART to have a function card saving system. I have to uninstall and re install the app in order to fix my default payment option. Edit:The re installation doesnt work. I'd think the first thing a company ensures is that THEY get the money. In this case it really is a lost customer, cuz I'm TRYING to give you money walmart",1,24,1711793944000,We hear your words about the payment system. Please contact us at https://survey.walmart.com/app,1711799479000,Walmart
a12b9f69-cf4e-40a3-85fb-b72e02d4793c,"Terrible app. If you are planning a trip to the store it will not allow you to shop the store, showing what aisle items, if there at all, are located. It tries to force either pickup or delivery. Can't see store mode unless actually in the store and even then can kick you out into delivery or pickup mode! Shopping Walmart less, too cumbersome.",1,4,1711753971000,"We'd like to know more details about your experience with our app, Lorraine. Please share your valuable input at https://survey.walmart.com/app",1711759766000,Walmart
2bac0584-6984-4e59-b890-b11737da2d28,"App works great on my phone. But it keeps crashing on my tablet. I don't know why. No other app is doing this. I have cleared cache, data, uninstalled, reinstalled and there's no updates to install. I don't know what else to do. I like online shopping on a bigger screen than my phone",1,0,1710716479000,We regret to learn of your experience with the Walmart App. Please use https://survey.walmart.com/?walmart-store-core to get in touch with us.,1710718034000,Walmart
7607ecc8-102f-4384-943a-a23b95db0755,"I'm trying to start a return in the app. When it gets to my itemized receipt, there are no images populated, with the items I purchased, just prices. I cannot tell by the price, the items I need to return. Also, when I park to pick up my items, the I'm Finished button covers the car colors.",3,1,1712356149000,"Your input helps us improve. If there's anything else you'd need further assistance, please connect us at https://www.walmart.com/help.",1712359353000,Walmart
46f17202-c6b0-468c-83bd-a8398a73f43e,"Good app, but the pop-ups are way too intrusive. They cause my app to become slow and make simple tasks more difficult because they get in the way, and you just don't want to accidentally click the wrong button and subscribe to Walmart+. I understand you need ways to advertise Walmart+, Card Offers, etc. But you don't need to get all up in my business about it. It makes me less likely to even consider subscribing at this point. Please find a better way.",3,37,1715610499000,We'll find a balance to ensure a better browsing experience. Please connect with us at: https://survey.walmart.com/app,1715620880000,Walmart
c4b4c840-78a5-4268-9fd2-a4a59dd4223a,"Love using the app every time. I'm someone who doesn't like shopping in large crowds, and I usually do my groceries through this app. Highly suggest you try Walmart Plus. It's very beneficial! I work twelve hours, so it's nice not having to go grocery shopping immediately after work. With this app, I'm able to select what I need and pick it up!",5,11,1709285800000,Thank you for sharing your positive experience with the Walmart app. We're delighted to hear that it's been so convenient for you. We appreciate your recommendation of Walmart+ for grocery shopping.,1709287746000,Walmart
4d7d3d4f-86c2-4fe3-b6fc-080c1cf2043a,"I'm so disappointed with the Walmart app! They hold your money & try to blame it on your bank. My order total was $134.58 but, because I was charged for item's they had when I placed my order but, when it was close to time to pickup the order the items were no longer available, which doesn't make sense either. when I ordered those item's they should have been put back for my order not left on the shelf to be sold. I also opted out for substitutions so I shouldn't have been charged at all!",1,25,1708644716000,We would like to get more information about what happened. Please contact us at walmart.com/grocery/help for assistance.,1708650022000,Walmart
5e678c3c-7ac7-4474-b7f2-64527d7b29ad,"The Walden family has more than enough money for this service to NOT have to be this frustrating. You're basically gambling your good mood away almost every order. Poor communication, missing items, ambiguous order updates. They do refunds well at least...perhaps not a great quality considering. For someone without a vehicle, it's a great service that's works well when it wants to. Otherwise, in need of some improvements.",2,22,1711255166000,"We're actively working to address these issues and make necessary improvements to enhance the overall shopping experience for all our customers. If you have further input to share, please connect at https://survey.walmart.com/app.",1711262334000,Walmart
79560480-af5c-4c5b-b3b6-3bab944b758a,There should be a selection for no vehicle when searching for specific items. I cannot find items that are usually available because it automatically searches for a vehicle in my profile even though I need something else. I can't even remove the cars from my profile because even if the vehicle has been deleted it still forcibly looks for compatible things for that vehicle,1,4,1712008095000,Thanks for sharing your experience with us. Kindly offer us more information at https://survey.walmart.com/app to assist you further.,1712011523000,Walmart
9eb54cb3-62ae-4f2d-b7a2-d4cd31274f8a,"Walmart+ member- The latest update broke the apps ability to connect to Mobil/Exxon fuel pumps. I went to two different stations, tried two different pumps at each, and kept getting the error ""Something went wrong, unable to connect to pump. Try again later."" No issues with credit card or mobile data. There is no work around at Mobil/Exxon to get the 10¢ off/gal discount. Fix the app!!",1,11,1713938166000,Thank you for bringing this to our attention. We are dedicated to improving the user experience. For further assistance would you mind reaching out to us on walmart.com/help,1713938561000,Walmart
2af3595c-2059-4e30-96b5-7f636902e710,"I can't be the ONLY one who sent my husband to pick up my grocery order. I'm unable to ADD his phone number so he can check in. That a pretty big flaw on the website as MOST couples have separate phone numbers. This was my 1st time ordering groceries and it did not go smoothly for how long THIS has been up and running. Plus after downloading app, there is a msg to .. download app.. wth?!",2,0,1711676228000,Your insights are valuable as we continually strive to improve. Share more of your thoughts with us at https://survey.walmart.com/app. We're here to ensure your shopping experience meets your expectations.,1711684299000,Walmart
