reviewId,content,score,thumbsUpCount,at,replyContent,repliedAt,appName
abe39fc5-f518-4271-82ad-22d7bc189315,"Fantastic app! It's so easy to use, and I rarely have issues with the app itself. Ordering online is so easy. And if there's ever an issue, refunds are a breeze. I just wish I could choose which list favorite items go to. I like that when I am in the store, I can look up an item, and it will tell me what aisle the item is in. No need to search for an employee!",4,153,1722395439000,We value our customers review. Please provide us with more info at https://survey.walmart.com/app,1722473249000,Walmart
39f4ad11-34e1-401a-a93a-5fa98e98393e,"Walmart Pay was finally going to be helpful. I occasionally need a physical receipt. Then, the other day, I got one with just using Walmart pay. When it kept happening, I was thrilled thinking this was a permanent option. Having both a physical and digital receipt. I'd never have to worry about needing a physical receipt again. Then, they erased the feature, not long after. Now, when I need a physical receipt, I have to remember to dig out my credit card. I want that feature back!",3,18,1723259261000,"Madison, we understand how crucial it is to manage your receipts effectively, and we value your input. Please share them with us here: https://survey.walmart.com/app",1723259530000,Walmart
30ad935c-da9d-4b61-9eaa-428bd0392967,"I've been using this app for years and it has major issues. With all the money Walmart has, they can't hire someone to fix it? Some items are obviously WAY overpriced, and clearly it's an error. Items are often listed as in stock, but they are not; and some shipping items never arrive, because they claim the item is delayed, but they often don't tell you that your order was actually canceled. I really appreciate being able to order online, but Walmart needs to fix these issues.",3,68,1722433575000,"We understand the frustration with app issues, incorrect pricing, and order inconsistencies. Your concerns are important to us, and we're committed to improving the app and ensuring accurate information and reliable delivery. Please tell us more details at https://www.walmart.com/help",1722446574000,Walmart
360e62e4-7dc7-4069-bb35-0ba9dc581b96,"apps design is pretty good. But I can't give 5 stars because of its seriously annoying technical issues. It starts to stutter after using it for only a few minutes and will eventually lock up forcing me to restart the app. It's not just a problem on my phone, I've had it happen on several others now. It has had this problem for a long time too, I really wish they'd figure out a solution!",3,11,1723208146000,We’re glad you like the app’s design but understand your frustration with the technical issues. Please share more info with us at https://www.walmart.com/help for assistance.,1723210535000,Walmart
e9eca83d-26ee-44be-8047-d097234bca01,"The main feature I use on this app gives me the most problems. I've said this before and I'll say it again. The 'list' feature used to be so nice some years back, but now it glitches when you're just scrolling through or try to remove an item. It would also be nice if they brought back the ability to drag items to adjust the order you want them in. It used to be so nice to be able to add things to my list throughout the week, then just drag them into the order according to aisle numbers.",3,9,1723243130000,"Your input is valuable to us. To get this looked into further, please add additional details at: https://survey.walmart.com/app",1723248612000,Walmart
df522eff-eaa7-4b0d-8883-ce46dcb38742,"Scan and Go was a complete waste of my time. I thought it was like the Sam's Club version where the entire checkout is on your phone. So, when I scanned my items to check out, I then had to go find an open register. Then the register called for associate assistance. When I flagged one down, she had no idea what she was supposed to do, so left to find another associate. At this point, I was frustrated, so abandoned my items and left. It would have been faster to scan with the register.",2,28,1722582426000,"Thanks, Brad, for sharing your experience with us. We’re sorry you’ve had issues while using the Walmart app. Please provide us with more info at https://survey.walmart.com/app",1695336407000,Walmart
bb4000b3-b9d6-41ca-8e42-4dd69d9b0588,"This has happened to me twice now: I set an appointment through the app to get my oil changed, drive down to the store, wait in line to get checked in, only to find out that they don't have the right oil filter for my car. This seems like an easy thing to check when you check in. Edit: went to that website, couldn't find option for ""stop app from wasting people's time"".",1,13,1722402079000,Thank you for sharing your experience. Please contact us at walmart.com/help so we can resolve this issue promptly.,1722399094000,Walmart
9dc2d957-2440-4b23-b3ee-c0903f32e373,"The app is convenient for pickups and online shopping, however you could have the absolute best internet connection in the world and the app still will not load and say there's no internet connection. Every single time. It's super frustrating when you have numerous things to do and don't have time to run into the store to grab what you need and you can't rely on the app to do a pick up order.",1,15,1722893684000,"We’re here for you. Please reach out at https://www.walmart.com/help, so we can help resolve this.",1722896911000,Walmart
8feea274-e29b-4ed8-902a-3a2c0c4df950,App is inconsistent. Doesn't matter what I'm searching for I'm not always allowed to filter my search. I want a filter every search I do but it is a crapshoot whether I am able to even filter anything or if I have to go through Page after page after page of products to try and find what I want. You would think with how much money Walmart has to put towards its competition with Amazon online they were able to at least get the app right.,1,21,1722564209000,Your insights are crucial for our continuous improvement. Please reach out to https://survey.walmart.com/app with more details.,1722564785000,Walmart
e7ea580f-0443-45b5-9683-f05fe149ffb9,"has been very slow, flips to other screens, search very hard to do. Happens during shopping can not recreate for developer to see app is usually pretty fast. No worries. Leaving my review as is, need to understand, if item states shipping arrives 3days, and when I go to pay states arrives Aug 22nd, what happened, I personnelly have not uncountered this before, always matched. Could not find a way to notify Walmart directly with this. Needed this product by Monday. Tuesday latest.",3,11,1722702162000,We'd like to look into this for you. Please contact us at walmart.com/help,1722644255000,Walmart
f06c914e-a2ab-4439-a8d5-ca42d74594ac,For almost a year I've been using the Walmart app to order my groceries and really love it! Unfortunately for the past week I am unable to buy bottled water for delivery. It doesn't seem to be a stock issue since the same water is available for pickup. Will be going back to my previous provider since they still deliver bottled water. Would have been nice if Walmart actually alerted me of this instead of spending time with customer service.,1,8,1722841626000,"Omi, we understand your concerns. Let's work together to understand what's causing this. Please click on this link to provide more details: https://www.walmart.com/help",1722842915000,Walmart
84af81cf-1e21-4c0c-8195-0633d5eeaadc,"when I make a return, I usually am spending the refund on the same trip back to the store. I tend to always just do a refund to store credit to avoid having to wait for the bank transactions to come back. is there any chance to avoid wasting gift cards that you can allow a used gift card to be loaded with a refund so that I can just keep one in my wallet for that purpose. I just hate throwing them away every time :) customer service at my store is fantastic by the way",2,7,1723093652000,"Daniel, we acknowledge your suggestion. Please contact us at https://www.walmart.com/help.",1723097392000,Walmart
f9b94cf6-2497-4f5d-8811-66864b916790,"This app is really frustrating. Normally they allow W+ to deliver on items $25 and above. Today it's charging me, a W+ member, delivery fees($6.99) on $32(delivery) + $16 (free shipping) when I'm checking out both together. This economy is bad enough & we shouldn't be forced to make purchases over $35 for W+ delivery. They should calculate both carts combined for the minimum.",1,6,1723202204000,Thanks for bringing this to our attention. Please reach out to us to clarify your charges and ensure you're getting the benefits of your Walmart+ membership at https://www.walmart.com/help,1723202573000,Walmart
c1858691-d58c-4269-a341-c1f3e0790d95,"Not a bad app it just needs fine-tuning, better user interface/navigational functionality throughout the app. Also I would suggest a way to sort my purchase history based on my method of payment, also when browsing manufacturer offers for Walmart cash there needs to be something I can push to accept all offers because it can take hours trying to make sure I scroll and look at every offer available to check it one box at a time.",3,7,1723096158000,"Justin, thanks for sharing your thoughts on sorting purchase history and streamlining offers. You can connect with us at https://survey.walmart.com/app for our specialists to review.",1723097053000,Walmart
769b789f-1c8b-4c7b-b249-3103b51a95ad,"Apparently there is a system outage currently going on with the app when trying to check out. Only suggestions from customers support is to uninstall and install the app again. After several attempts, the issue still remains. I believe the app update on 7/31/24 has unpatched glitches and is responsible for all of the current problems being experienced nationwide.",1,8,1723057849000,Improving your experience is our goal. Contact us at walmart.com/help for further assistance.,1723060209000,Walmart
21e73474-2d88-422b-b763-83b0a4a50977,I was charged TWICE for the monthly membership fee. Customer Service was no assistance. Escalated my call to the Supervisor. What I was told is that they charged me the current month (August) and placed a hold in the same amount. Come September they would then deduct the payment from my account and the duplicate charge (for the HOLD) would possibly still be there. I cancelled the service today and will not do business again with Walmart. Cheap isn't so cheap when you are charged twice.,1,1,1722734279000,,,Walmart
8156f4a7-b41b-4bc2-b946-8110053630c8,"Great service with delivery, no charge, an optional tip to the delivery person (please do do that), and for the most part pretty accurate. I say that knowing that I have put the wrong thing in my cart occasionally. **However, I wish these big box stores would dump the 3rd party overpriced products. Shouldn't there be some sort of limit to how much they can price an item over the common retail price? How many have ordered something not seeing the price & no returns on 1 $40 bottle of juice? BS**",4,3,1722364596000,It's great to hear you enjoyed the delivery service. Your thoughts are appreciated. We encourage you to share more details through the link at https://survey.walmart.com/app.,1722474604000,Walmart
b5fd5aea-4908-44a8-8a85-0d2c5ded4f21,"You know what?, if it wasn't for me needing delivery so bad every month because I don't have a car, I would cancel my membership and be done with walmart completely. Everytime I order delivery now, it's either delayed, items missing, items damaged, or they charge me too much (charged me 2x) and I have to call and complain everytime. Another thing about the app. Fix the payments when I make an order then leave the checkout page to go add something else, it glitches the payments. Have to restart",2,22,1722711032000,We've noted your experience and would like to delve deeper into it. Please get in touch with us at walmart.com/help.,1722711389000,Walmart
260fce0e-87e8-4c4e-b5c1-ffa46791cfa9,"I have used this app religiously for years now and up until a few days ago I've never had an issue. Now, I cannot scan barcodes. It will not work no matter what I try. I've checked the permissions, there's good lighting, the barcode isn't blurry. Like I said, I've used this a million times in the past. I can pull up the barcode scan page, and it acts like it wants to scan it, but when it goes to pull up the price, it just loads and doesn't go no where. I'm using a Samsung galaxy s20 ultra",2,30,1721721551000,,,Walmart
7a85fd88-52fd-4469-82e8-e8d5e59f85a7,"Please fix the app! I can't use the scanner, the app freezes several times while trying to fill the cart, search for items, checking out! The same trying to use it in store. Can't search by the isle, can't scan. I order tea by the bottles. Walmart app will not work . App freezes constantly! You can't get finished with a order without it freezing at least three times before actually placing it. The app is terrible!!!",1,34,1722205574000,Thanks for sharing your experience with us. We’re sorry you’ve had issues while using the Walmart app. We’ve shared your issue with our App Development Team. Please provide with more info at https://survey.walmart.com/app,1672079255000,Walmart
dda02644-dd07-460a-b665-cedf559250a3,"""We're sorry. we're unable to load your cart"". Can't order if I can't load my cart. The option to filter disappears sometimes. If I can't filter out third party sellers forget it. Otherwise I love it. better than going to the store. only bug is sometimes it scrolls up while you're trying to scroll down and read something. I bet they do this so you take more look at the items j/k",2,51,1721943466000,"Glad to hear you're loving the app! As for those sneaky scrolls, we promise it's not intentional—must be a case of tech shenanigans! We'll look into it. Kindly share more info with us at https://survey.walmart.com/app",1718109298000,Walmart
51a62025-e009-4ea6-b229-d50658089aa5,"Watch your prices between the item description and the check out cart. I found an item marked down to $6 from $17 and put 4 in my cart. Went to my cart to find they were trying to charge me $39 each item. Talked to customer service and got told they would take my word for it but they deleted the items from my cart and I couldn't find it again to add back. So instead of honoring the price, they just took it all down and left me with nothing in return. Not impressed.",1,27,1722236016000,Thank you for bringing this to our attention. Please connect with us at walmart.com/help for further assistance. We aim to resolve this matter swiftly.,1722395558000,Walmart
b15e0246-a4a4-45a9-86d8-8d9686ea5cf5,"lots of products are horribly misclassified. The search is sloppy. searches for vegan products usually include meat in the results. It frequently invites me to rate products, but most of the time is days, ""something went wrong"" and won't accept the review. I like shopping online, but Walmart really needs to step up their game. With all the AI tools available, the product classification could be much better.",2,37,1721607074000,,,Walmart
546be368-1dbc-4a06-a3b5-d62ffbe73cbc,"I've ordered several times from Walmart & I always say it's my last time bc there's frequently an issue. My biggest problem is not being able to make substitutions easily for items that are out of stock. It's frustrating to me when the website says an item is in stock but it's magically sold out when the shopper is fulfilling the order. If that happened occasionally, I could understand, but it happens almost every time I place an order. It's inconvenient & a hassle. Instacart is better.",2,50,1721952917000,"Julie, we're committed to ensuring accurate stock information on our website. Reach out to us at: https://www.walmart.com/help",1722400946000,Walmart
b35c7942-ba42-40d6-b0a0-85365896dd8f,It's ok sometimes. I just don't like that they constantly tell you they're out of stock. Plus they need to do a better option for substitutions to where you shouldn't have to go through the entire order. just click on only the ones you want. Sometimes my orders get mixed up with other products but they will refund you if you contact them.,4,0,1723370813000,"Thanks for sharing your thoughts! We’re always working on making stock updates and substitutions even smoother. If you have any more thoughts to share or need assistance, we’re here to help at https://www.walmart.com/help",1723378756000,Walmart
5865b554-4080-4294-b9ce-75e3aa857b41,"Problems with unavailable merch showing in stock - unable to simply transfer order to nearby stores because they also show unavailable things in stock. I get that its a lot of stock to manage, but inventory is always inaccurate. App design is fine - I'd rather just use a website for curbside pickup, and Walmart wont allow anything but the app for such. Will delete as soon as I can actually fulfill the order, which may be much longer than anticipated.",1,1,1723255665000,We value your review and will look into this for you. Please contact us at walmart.com/help,1723256608000,Walmart
572686c0-82c2-4eab-ac5c-23eef937c0ea,"Update: No one at Walmart com will help with this issue. A rep said the Walmart app issues are handled separately, said someone would contact me in 24 hours. Nope. The price scanner has worked great for years. This week it stopped working. Customer service has thus far not been able to help me get it fixed. I scan an item's upc code and it appears to be retrieving the price, but never displays it. I tried deleting the app and reinstalling; still not working.",1,82,1721638297000,"We’re here for you. Please reach out at https://www.walmart.com/help, so we can help resolve this.",1721124914000,Walmart
3c39ee74-796c-43d7-bfa5-2786d3ba97a2,"They stay trying to scam you. One second something is $15 then by the time you go to check out its now all of a sudden a quick price change to to $50! This just happened. AGAIN. They keep playing with the prices online, double check them before you pay because the price it was when you added to cart will NOT be the same price by the time you go check out. They know most folks aren't going to recheck the price for something wildly unexpected like that & end up getting scammed. Target would never.",1,14,1722725868000,"That sounds really frustrating. We’re working constantly to ensure price consistency and transparency. For immediate help or to discuss this further, please reach out here: https://www.walmart.com/help",1722727664000,Walmart
d6ee6087-9cd6-4419-8672-be77970f33fe,"After the new design, I can't use the scanner function in the store. It's always ""cannot find a match"" even if I nanually entered the barcode! They also removed all the price checker in the store. What a mess did you do in your App just to incorporate Walmart+ with huge membership fee. Even more expensive than Sam's Club and Costco membership! Fix your App! Everything in your App is a mess right now! I can't even search In-store items and locate the aisle.",1,71,1721437555000,,,Walmart
43ade34a-71de-416f-a90c-697552c28101,"Sometimes the store location for pickup changes- based on where you physically are while using the app, perhaps. At least 4x this resulted in a pickup order being placed far from my home. then I have to cancel it, wait for a refund and either replace the order or shop it myself. the app should have an ""are you sure?"" message before finalizing pick up orders at the non-defsult store. Also the default store in my account should never change unless I do it manually.",3,31,1722147002000,"Your suggestion for the app is valuable, Melissa. Please share them with us at: https://survey.walmart.com/app",1722404318000,Walmart
805c5c56-b683-49cc-872d-eb542519f977,"App sucks. When an item is out of stock, it suggests to substitute a completely different item or gives not substitution option, at all. Can not edit shipping list, in either case, to get a similar item or a different brand. Corporate keeps saying there's an option & apologizes, but it doesn't & nothing gets fixed on the app.",2,4,1721711751000,,,Walmart
c82fe95f-2834-460f-b487-8d8c97f6bffe,"Works great but spammy spammy spammy notifications. Even though I've turned off all notifications other than related to telling me about orders being ready, it still tells me anytime I have something in the cart that I have not checked out. Recently, it has even started telling me that I LOOKED at something and should buy it. I'll buy it if I want it. I don't need a three-year-old nagging me about getting it now now now!",2,0,1722719656000,"Glad the app works well, but those extra notifications sound pesky! We'd like to learn more about them, Cindy. Please share more info with us at https://survey.walmart.com/app",1722720809000,Walmart
de7421a0-8646-4b1a-bada-8ad1a56e41ba,"This app sucks and now I will never be going shopping at Walmart again. I canceled an online order for food with a debit card same one I have canceled with before and always got my money back within hours but now I have to wait 2 weeks. Don't be messing with people's money! I'll be going to Winco now they have a better meat selection, they are open 24/7, and cheaper.",1,2,1722712243000,"We'd like to dive deeper into the issue you mentioned, Angeleia. Please reach us at https://www.walmart.com/help for assistance.",1722714337000,Walmart
980a586f-eec8-4448-93e0-8e3fffc3e136,It is a good app. I find it difficult adding or removing items before the pay window. Or putting any messages on the products themselves. Like for example substitute items you can't change the amount to purchase instead of the original amount I ordered on a different product.,4,1,1722569475000,"We value our customers review. Please provide us with more info at https://survey.walmart.com/app
",1722570588000,Walmart
7f6d4642-8f2c-4095-a9d0-e8aa764a3cb6,I like the service and convenience of delivery but have had issues with the delivery part broken eggs missing items to the point of having to be refunded over 50 dollars at times. Most deliveries are fine but lately it has been a problem. I live in assisted living and I can't get out to go grocery shopping so I depend on this service for my groceries.,3,0,1722551943000,"We're glad you find the service convenient, though the recent issues are concerning. For smoother deliveries and support, please reach out here: https://www.walmart.com/help",1722553271000,Walmart
14532e71-e0d3-41a0-a546-fe1ca49ba5dd,"App works. But the pickup and delivery system is terrible. Even when I have substitutions set to next best similar item,it just gets put as not available even though there are so many things it could have been substituted with. And when I do pick a specific thing to substitute it with because of that,9/10 it's the same outcome. And this happens with half my order most of the time. I wish I didn't need to use these services,but I do. Customer service is also completely not helpful.",4,68,1722866023000,"Thank you for sharing your input. To resolve these issues with pickup and delivery, please reach out to us at walmart.com/help. We’re committed to improving your experience.",1722884581000,Walmart
9b3fcb48-2d5c-481a-8057-d43dab48db4f,"I've been using this app routinely for a LONG time... specifically I use it to check where products are located in the store AND I love being able to scan items to check on pricing. However, sometime within the past month or so the scanner in the app no longer works!! I've done some research, and I see many others are having this same problem!! I've used the app for ages so I know what I'm doing. I've done nothing different to make it not work. I have the proper permissions for the app etc.",1,13,1721705223000,,,Walmart
2973de53-f2ae-4234-bd81-f88bfcb5402e,"Paid for Walmart+ for years, then suddenly ALL produce items are out of stock when I choose delivery. Contacted customer support 10 times and have been promised that this issue will be escalated but no one reached back to me. They are just unable to resolve the issue. Not sure if it's a local issue with their Union, NJ store but this has been going on for months now. Cancelling my membership...",1,1,1723083713000,"Ensuring fresh produce availability is important to us, and we’d love to look into this for you. Please reach us at https://www.walmart.com/help for assistance.",1723019688000,Walmart
32f4f36d-493f-47ce-8bba-795fe2d95653,"I like the convenience of online shopping. There's a big drawback, however. My orders are often incomplete because popular items are routinely unavailable despite being listed on the website. I don't particularly like the substitutions offered for the products I want. I also don't like the fact that I have to spend a minimum of $35 in order to have grocery pick up without a costly fee.",4,4,1722408202000,Your review is valuable to us. We're here to enhance your experience. Please reach out to https://survey.walmart.com/app with more details.,1722472539000,Walmart
da6f53b3-7934-4186-8059-f6de5409f1e2,I think that a company as big and wide spread as Walmart should be able to hire programmers and tech support that are skilled enough to make their app work without freezing up and forcing me to exit and return so many times. I request to see items from low price to high and they are NEVER listed that way. apparently they have changed their search and you have to go through several steps just to get to the category I want. Don't appreciate attempt to manipulate me into browsing.,3,0,1723243273000,"Sue, your concerns matters to us. Please contact us at https://www.walmart.com/help, so we can look into this further.",1723249125000,Walmart
